[
    {
        "dish_name": "Rice Cakes",
        "ingredients": [
            {
                "name": "Rice Cakes",
                "quantity": 2,
                "unit": "cakes"
            }
        ],
        "dietary_restrictions": [
            "vegan",
            "vegetarian",
            "gluten-free",
            "dairy-free",
            "nut-free"
        ],
        "nutritional_information": {
            "calories": 70,
            "protein_grams": 1,
            "carbohydrates_grams": 15,
            "fat_grams": 0.5
        }
    },
    {
        "dish_name": "Pancakes",
        "ingredients": [
            {
                "name": "Pancake Mix",
                "quantity": 1,
                "unit": "cup"
            },
            {
                "name": "Water",
                "quantity": 0.75,
                "unit": "cup"
            }
        ],
        "cuisine": "American",
        "preparation_time_minutes": 10,
        "cooking_time_minutes": 20
    }
]